{
  "schema": "chuanhoa.canonical-rule-release.v1",
  "releaseId": "VBA-BASELINE-2026-09-01",
  "status": "BaselineDraft",
  "createdAtUtc": "2026-09-01T00:00:00Z",
  "effectiveFromUtc": null,
  "effectiveUntilUtc": null,
  "sourceBaselineId": "CORRECTION-RULE-ROUTE-BASELINE-001",
  "rules": [
    {
      "ruleCode": "LOCAL-TYPO-DICT",
      "regimeCode": "LOCAL_TYPOGRAPHY",
      "lifecycleStatus": "Draft",
      "title": "Baseline LOCAL-TYPO-DICT",
      "description": "Unreviewed VBA baseline definition. Semantic wording, legal traceability, fixtures, detector behavior, and fix policy must be approved before publication.",
      "provenance": {
        "sourceKind": "VBA_BASELINE",
        "sourcePath": "shared/vba_extracted/RuleData.bas.bas",
        "sourceSymbol": "CheckDictionaryTypo",
        "sourceHash": "D0CFD8F4BFF8C69E615C9326A567B31DD899C8751081E7E7DF324AE166CF54EB"
      },
      "implementation": {
        "status": "BaselineLogicPath",
        "routeFunction": "CheckDictionaryTypo",
        "detectorId": null,
        "verifiedEngineVersion": null
      },
      "legalReview": {
        "status": "Unreviewed",
        "authority": null,
        "instrument": null,
        "provision": null,
        "reviewer": null,
        "reviewedAtUtc": null
      },
      "fixtures": {
        "positiveFixtureIds": [],
        "negativeFixtureIds": [],
        "boundaryFixtureIds": []
      },
      "fixPolicy": "Blocked",
      "documentTypeCodes": [],
      "effectiveFromUtc": null,
      "effectiveUntilUtc": null
    },
    {
      "ruleCode": "LOCAL-TYPO-HIDDEN",
      "regimeCode": "LOCAL_TYPOGRAPHY",
      "lifecycleStatus": "Draft",
      "title": "Baseline LOCAL-TYPO-HIDDEN",
      "description": "Unreviewed VBA baseline definition. Semantic wording, legal traceability, fixtures, detector behavior, and fix policy must be approved before publication.",
      "provenance": {
        "sourceKind": "VBA_BASELINE",
        "sourcePath": "shared/vba_extracted/RuleData.bas.bas",
        "sourceSymbol": "CheckHiddenCharacters",
        "sourceHash": "D0CFD8F4BFF8C69E615C9326A567B31DD899C8751081E7E7DF324AE166CF54EB"
      },
      "implementation": {
        "status": "BaselineLogicPath",
        "routeFunction": "CheckHiddenCharacters",
        "detectorId": null,
        "verifiedEngineVersion": null
      },
      "legalReview": {
        "status": "Unreviewed",
        "authority": null,
        "instrument": null,
        "provision": null,
        "reviewer": null,
        "reviewedAtUtc": null
      },
      "fixtures": {
        "positiveFixtureIds": [],
        "negativeFixtureIds": [],
        "boundaryFixtureIds": []
      },
      "fixPolicy": "Blocked",
      "documentTypeCodes": [],
      "effectiveFromUtc": null,
      "effectiveUntilUtc": null
    },
    {
      "ruleCode": "LOCAL-TYPO-PUNCT",
      "regimeCode": "LOCAL_TYPOGRAPHY",
      "lifecycleStatus": "Draft",
      "title": "Baseline LOCAL-TYPO-PUNCT",
      "description": "Unreviewed VBA baseline definition. Semantic wording, legal traceability, fixtures, detector behavior, and fix policy must be approved before publication.",
      "provenance": {
        "sourceKind": "VBA_BASELINE",
        "sourcePath": "shared/vba_extracted/RuleData.bas.bas",
        "sourceSymbol": "CheckPunctuationSpacingTypo",
        "sourceHash": "D0CFD8F4BFF8C69E615C9326A567B31DD899C8751081E7E7DF324AE166CF54EB"
      },
      "implementation": {
        "status": "BaselineLogicPath",
        "routeFunction": "CheckPunctuationSpacingTypo",
        "detectorId": null,
        "verifiedEngineVersion": null
      },
      "legalReview": {
        "status": "Unreviewed",
        "authority": null,
        "instrument": null,
        "provision": null,
        "reviewer": null,
        "reviewedAtUtc": null
      },
      "fixtures": {
        "positiveFixtureIds": [],
        "negativeFixtureIds": [],
        "boundaryFixtureIds": []
      },
      "fixPolicy": "Blocked",
      "documentTypeCodes": [],
      "effectiveFromUtc": null,
      "effectiveUntilUtc": null
    },
    {
      "ruleCode": "LOCAL-TYPO-SPACE",
      "regimeCode": "LOCAL_TYPOGRAPHY",
      "lifecycleStatus": "Draft",
      "title": "Baseline LOCAL-TYPO-SPACE",
      "description": "Unreviewed VBA baseline definition. Semantic wording, legal traceability, fixtures, detector behavior, and fix policy must be approved before publication.",
      "provenance": {
        "sourceKind": "VBA_BASELINE",
        "sourcePath": "shared/vba_extracted/RuleData.bas.bas",
        "sourceSymbol": "CheckExtraSpaceTypo",
        "sourceHash": "D0CFD8F4BFF8C69E615C9326A567B31DD899C8751081E7E7DF324AE166CF54EB"
      },
      "implementation": {
        "status": "BaselineLogicPath",
        "routeFunction": "CheckExtraSpaceTypo",
        "detectorId": null,
        "verifiedEngineVersion": null
      },
      "legalReview": {
        "status": "Unreviewed",
        "authority": null,
        "instrument": null,
        "provision": null,
        "reviewer": null,
        "reviewedAtUtc": null
      },
      "fixtures": {
        "positiveFixtureIds": [],
        "negativeFixtureIds": [],
        "boundaryFixtureIds": []
      },
      "fixPolicy": "Blocked",
      "documentTypeCodes": [],
      "effectiveFromUtc": null,
      "effectiveUntilUtc": null
    },
    {
      "ruleCode": "LOCAL-TYPO-TELEX",
      "regimeCode": "LOCAL_TYPOGRAPHY",
      "lifecycleStatus": "Draft",
      "title": "Baseline LOCAL-TYPO-TELEX",
      "description": "Unreviewed VBA baseline definition. Semantic wording, legal traceability, fixtures, detector behavior, and fix policy must be approved before publication.",
      "provenance": {
        "sourceKind": "VBA_BASELINE",
        "sourcePath": "shared/vba_extracted/RuleData.bas.bas",
        "sourceSymbol": "CheckTelexLeftoverTypo",
        "sourceHash": "D0CFD8F4BFF8C69E615C9326A567B31DD899C8751081E7E7DF324AE166CF54EB"
      },
      "implementation": {
        "status": "BaselineLogicPath",
        "routeFunction": "CheckTelexLeftoverTypo",
        "detectorId": null,
        "verifiedEngineVersion": null
      },
      "legalReview": {
        "status": "Unreviewed",
        "authority": null,
        "instrument": null,
        "provision": null,
        "reviewer": null,
        "reviewedAtUtc": null
      },
      "fixtures": {
        "positiveFixtureIds": [],
        "negativeFixtureIds": [],
        "boundaryFixtureIds": []
      },
      "fixPolicy": "Blocked",
      "documentTypeCodes": [],
      "effectiveFromUtc": null,
      "effectiveUntilUtc": null
    },
    {
      "ruleCode": "ND30-PL1-M1-K1",
      "regimeCode": "ND30",
      "lifecycleStatus": "Draft",
      "title": "Baseline ND30-PL1-M1-K1",
      "description": "Unreviewed VBA baseline definition. Semantic wording, legal traceability, fixtures, detector behavior, and fix policy must be approved before publication.",
      "provenance": {
        "sourceKind": "VBA_BASELINE",
        "sourcePath": "shared/vba_extracted/RuleData.bas.bas",
        "sourceSymbol": "CheckPageSizeA4",
        "sourceHash": "D0CFD8F4BFF8C69E615C9326A567B31DD899C8751081E7E7DF324AE166CF54EB"
      },
      "implementation": {
        "status": "BaselineLogicPath",
        "routeFunction": "CheckPageSizeA4",
        "detectorId": null,
        "verifiedEngineVersion": null
      },
      "legalReview": {
        "status": "Unreviewed",
        "authority": null,
        "instrument": null,
        "provision": null,
        "reviewer": null,
        "reviewedAtUtc": null
      },
      "fixtures": {
        "positiveFixtureIds": [],
        "negativeFixtureIds": [],
        "boundaryFixtureIds": []
      },
      "fixPolicy": "Blocked",
      "documentTypeCodes": [],
      "effectiveFromUtc": null,
      "effectiveUntilUtc": null
    },
    {
      "ruleCode": "ND30-PL1-M1-K2",
      "regimeCode": "ND30",
      "lifecycleStatus": "Draft",
      "title": "Baseline ND30-PL1-M1-K2",
      "description": "Unreviewed VBA baseline definition. Semantic wording, legal traceability, fixtures, detector behavior, and fix policy must be approved before publication.",
      "provenance": {
        "sourceKind": "VBA_BASELINE",
        "sourcePath": "shared/vba_extracted/RuleData.bas.bas",
        "sourceSymbol": "CheckPageOrientation",
        "sourceHash": "D0CFD8F4BFF8C69E615C9326A567B31DD899C8751081E7E7DF324AE166CF54EB"
      },
      "implementation": {
        "status": "BaselineLogicPath",
        "routeFunction": "CheckPageOrientation",
        "detectorId": null,
        "verifiedEngineVersion": null
      },
      "legalReview": {
        "status": "Unreviewed",
        "authority": null,
        "instrument": null,
        "provision": null,
        "reviewer": null,
        "reviewedAtUtc": null
      },
      "fixtures": {
        "positiveFixtureIds": [],
        "negativeFixtureIds": [],
        "boundaryFixtureIds": []
      },
      "fixPolicy": "Blocked",
      "documentTypeCodes": [],
      "effectiveFromUtc": null,
      "effectiveUntilUtc": null
    },
    {
      "ruleCode": "ND30-PL1-M1-K3",
      "regimeCode": "ND30",
      "lifecycleStatus": "Draft",
      "title": "Baseline ND30-PL1-M1-K3",
      "description": "Unreviewed VBA baseline definition. Semantic wording, legal traceability, fixtures, detector behavior, and fix policy must be approved before publication.",
      "provenance": {
        "sourceKind": "VBA_BASELINE",
        "sourcePath": "shared/vba_extracted/RuleData.bas.bas",
        "sourceSymbol": "CheckPageMargins",
        "sourceHash": "D0CFD8F4BFF8C69E615C9326A567B31DD899C8751081E7E7DF324AE166CF54EB"
      },
      "implementation": {
        "status": "BaselineLogicPath",
        "routeFunction": "CheckPageMargins",
        "detectorId": null,
        "verifiedEngineVersion": null
      },
      "legalReview": {
        "status": "Unreviewed",
        "authority": null,
        "instrument": null,